<?xml version="1.0" encoding="utf-8" ?>
<upd:Updates xmlns:upd="http://code.google.com/p/dbkeepernet/Updates-1.0.xsd"
                	xmlns:xsi="http://www.w3.org/2001/XMLSchema-instance"
	              xsi:schemaLocation="http://code.google.com/p/dbkeepernet/Updates-1.0.xsd ../DbKeeperNet.Engine/Resources/Updates-1.0.xsd"
                AssemblyName="DbUpdater.Engine.Membership">
  <DefaultPreconditions>
    <Precondition FriendlyName="Update step executed" Precondition="StepNotExecuted"/>
  </DefaultPreconditions>
  <Update Version="1.00">
    <UpdateStep xsi:type="upd:CustomUpdateStepType" Id="1" Type="DbKeeperNet.Engine.Windows.CustomUpdateSteps.MsSqlStepWithoutExplicitTransaction, DbKeeperNet.Engine.Windows"  FriendlyName="Setting up database schema for membership and roles">
      <Preconditions>
        <Precondition FriendlyName="Update step executed" Precondition="StepNotExecuted"/>
        <Precondition FriendlyName="Database is MSSQL" Precondition="DbType">
          <Param>MSSQL</Param>
        </Precondition>
      </Preconditions>
      <Param>DbKeeperNet.Extensions.MsSqlMembershipAndRolesSetup</Param>
      <Param>DbKeeperNet.Extensions.MsSqlMembershipAndRolesSetup.MsSqlMembershipAndRolesSetup.sql</Param>
    </UpdateStep>
  </Update>
</upd:Updates>

